{
  "version": "ariad-capabilities/0",
  "generated_at": "2026-10-07T03:29:05Z",
  "bench": {
    "fixture_count": 41,
    "pandoc_version": "3.12",
    "ashift_version": "0.0.0"
  },
  "edges": [
    {
      "from": "ariad-ir+json",
      "to": "docx",
      "engine": "pandoc",
      "runtime": [
        "local"
      ],
      "license": "GPL-2.0-or-later",
      "metrics": {
        "fidelity": 0.991,
        "editability": 0.971,
        "p50_ms": 100.0,
        "peak_mem_mb": 216.0,
        "samples": 30
      }
    },
    {
      "from": "ariad-ir+json",
      "to": "epub",
      "engine": "pandoc",
      "runtime": [
        "local"
      ],
      "license": "GPL-2.0-or-later",
      "metrics": {
        "fidelity": 0.851,
        "editability": 0.786,
        "p50_ms": 80.0,
        "peak_mem_mb": 242.0,
        "samples": 28
      }
    },
    {
      "from": "ariad-ir+json",
      "to": "html",
      "engine": "ariad-core",
      "runtime": [
        "wasm",
        "local"
      ],
      "license": "Apache-2.0",
      "metrics": {
        "fidelity": 1.0,
        "editability": 1.0,
        "p50_ms": 0.0,
        "peak_mem_mb": 8.0,
        "samples": 30
      }
    },
    {
      "from": "ariad-ir+json",
      "to": "markdown",
      "engine": "ariad-core",
      "runtime": [
        "wasm",
        "local"
      ],
      "license": "Apache-2.0",
      "metrics": {
        "fidelity": 0.989,
        "editability": 0.981,
        "p50_ms": 0.0,
        "peak_mem_mb": 8.0,
        "samples": 13
      }
    },
    {
      "from": "docling+json",
      "to": "ariad-ir+json",
      "engine": "ariad-core",
      "runtime": [
        "wasm",
        "local"
      ],
      "license": "Apache-2.0",
      "metrics": null
    },
    {
      "from": "docx",
      "to": "ariad-ir+json",
      "engine": "pandoc",
      "runtime": [
        "local"
      ],
      "license": "GPL-2.0-or-later",
      "metrics": {
        "fidelity": 1.0,
        "editability": 1.0,
        "p50_ms": 200.0,
        "peak_mem_mb": 145.0,
        "samples": 5
      }
    },
    {
      "from": "docx",
      "to": "docling+json",
      "engine": "docling",
      "runtime": [
        "local"
      ],
      "license": "MIT",
      "metrics": null
    },
    {
      "from": "epub",
      "to": "ariad-ir+json",
      "engine": "pandoc",
      "runtime": [
        "local"
      ],
      "license": "GPL-2.0-or-later",
      "metrics": {
        "fidelity": 1.0,
        "editability": 1.0,
        "p50_ms": 80.0,
        "peak_mem_mb": 44.0,
        "samples": 4
      }
    },
    {
      "from": "html",
      "to": "ariad-ir+json",
      "engine": "ariad-core",
      "runtime": [
        "wasm",
        "local"
      ],
      "license": "Apache-2.0",
      "metrics": {
        "fidelity": 1.0,
        "editability": 1.0,
        "p50_ms": 0.0,
        "peak_mem_mb": 8.0,
        "samples": 4
      }
    },
    {
      "from": "jpeg",
      "to": "docling+json",
      "engine": "docling",
      "runtime": [
        "local"
      ],
      "license": "MIT",
      "metrics": null
    },
    {
      "from": "markdown",
      "to": "ariad-ir+json",
      "engine": "ariad-core",
      "runtime": [
        "wasm",
        "local"
      ],
      "license": "Apache-2.0",
      "metrics": {
        "fidelity": 1.0,
        "editability": 1.0,
        "p50_ms": 0.0,
        "peak_mem_mb": 9.0,
        "samples": 28
      }
    },
    {
      "from": "pdf",
      "to": "docling+json",
      "engine": "docling",
      "runtime": [
        "local"
      ],
      "license": "MIT",
      "metrics": null
    },
    {
      "from": "png",
      "to": "docling+json",
      "engine": "docling",
      "runtime": [
        "local"
      ],
      "license": "MIT",
      "metrics": null
    },
    {
      "from": "pptx",
      "to": "docling+json",
      "engine": "docling",
      "runtime": [
        "local"
      ],
      "license": "MIT",
      "metrics": null
    },
    {
      "from": "tiff",
      "to": "docling+json",
      "engine": "docling",
      "runtime": [
        "local"
      ],
      "license": "MIT",
      "metrics": null
    },
    {
      "from": "webp",
      "to": "docling+json",
      "engine": "docling",
      "runtime": [
        "local"
      ],
      "license": "MIT",
      "metrics": null
    },
    {
      "from": "xlsx",
      "to": "docling+json",
      "engine": "docling",
      "runtime": [
        "local"
      ],
      "license": "MIT",
      "metrics": null
    }
  ]
}
